[
  {"authority_name":"ACARA","authority_type":"statutory curriculum authority","authority_evidence_url":"https://www.acara.edu.au/about-us","publication_owner":"Australian Curriculum, Assessment and Reporting Authority (ACARA)","authority_verification_status":"verified","jurisdiction":"Australia","school_phase":"F-10","learning_area_or_subject":"English","document_title":"English | V9 Australian Curriculum","version_or_effective_year":"9.0","url":"https://www.australiancurriculum.edu.au/curriculum-information/understand-this-learning-area/english","locator":"Learning area > English > Structure","licence":"Creative Commons Attribution 4.0 International (CC BY 4.0)","retrieval_date":"2026-08-30","content_hash":"sha256:9be674b90d04d528e57c296312d94323149bdf9f995b0e89288b7f8c208c91d2"},
  {"authority_name":"ACARA","authority_type":"statutory curriculum authority","authority_evidence_url":"https://www.acara.edu.au/about-us","publication_owner":"Australian Curriculum, Assessment and Reporting Authority (ACARA)","authority_verification_status":"verified","jurisdiction":"Australia","school_phase":"F-10","learning_area_or_subject":"Mathematics","document_title":"Mathematics | V9 Australian Curriculum","version_or_effective_year":"9.0","url":"https://www.australiancurriculum.edu.au/curriculum-information/understand-this-learning-area/mathematics","locator":"Learning area > Mathematics > Structure","licence":"Creative Commons Attribution 4.0 International (CC BY 4.0)","retrieval_date":"2026-08-30","content_hash":"sha256:84ffe87e6f1800ac77759825dc9192e0978f4ac919ec3c038c8dceb436e92194"},
  {"authority_name":"ACARA","authority_type":"statutory curriculum authority","authority_evidence_url":"https://www.acara.edu.au/about-us","publication_owner":"Australian Curriculum, Assessment and Reporting Authority (ACARA)","authority_verification_status":"verified","jurisdiction":"Australia","school_phase":"F-10","learning_area_or_subject":"Science","document_title":"Science | V9 Australian Curriculum","version_or_effective_year":"9.0","url":"https://www.australiancurriculum.edu.au/curriculum-information/understand-this-learning-area/science","locator":"Learning area > Science > Structure","licence":"Creative Commons Attribution 4.0 International (CC BY 4.0)","retrieval_date":"2026-08-30","content_hash":"sha256:a429f28b31352a625bf47d8759416103ea4c4bf16e859ff75d286f751a2e3179"},
  {"authority_name":"ACARA","authority_type":"statutory curriculum authority","authority_evidence_url":"https://www.acara.edu.au/about-us","publication_owner":"Australian Curriculum, Assessment and Reporting Authority (ACARA)","authority_verification_status":"verified","jurisdiction":"Australia","school_phase":"F-10","learning_area_or_subject":"Health and Physical Education","document_title":"Health and Physical Education | V9 Australian Curriculum","version_or_effective_year":"9.0","url":"https://www.australiancurriculum.edu.au/curriculum-information/understand-this-learning-area/health-and-physical-education","locator":"Learning area > Health and Physical Education > Structure","licence":"Creative Commons Attribution 4.0 International (CC BY 4.0)","retrieval_date":"2026-08-30","content_hash":"sha256:a22401afd2e1706235d7d46838f0cf12604a4f48e1a8b05a453f271f1fc273a0"},
  {"authority_name":"ACARA","authority_type":"statutory curriculum authority","authority_evidence_url":"https://www.acara.edu.au/about-us","publication_owner":"Australian Curriculum, Assessment and Reporting Authority (ACARA)","authority_verification_status":"verified","jurisdiction":"Australia","school_phase":"F-10","learning_area_or_subject":"Humanities and Social Sciences","document_title":"Humanities and Social Sciences | V9 Australian Curriculum","version_or_effective_year":"9.0","url":"https://www.australiancurriculum.edu.au/curriculum-information/understand-this-learning-area/humanities-and-social-sciences","locator":"Learning area > Humanities and Social Sciences > Structure","licence":"Creative Commons Attribution 4.0 International (CC BY 4.0)","retrieval_date":"2026-08-30","content_hash":"sha256:955acf64c8e8dfe7af065e32a645d21ecdabe4429dc0b8d775b53975ddba7e02"},
  {"authority_name":"ACARA","authority_type":"statutory curriculum authority","authority_evidence_url":"https://www.acara.edu.au/about-us","publication_owner":"Australian Curriculum, Assessment and Reporting Authority (ACARA)","authority_verification_status":"verified","jurisdiction":"Australia","school_phase":"F-10","learning_area_or_subject":"The Arts","document_title":"The Arts | V9 Australian Curriculum","version_or_effective_year":"9.0","url":"https://www.australiancurriculum.edu.au/curriculum-information/understand-this-learning-area/the-arts","locator":"Learning area > The Arts > Structure","licence":"Creative Commons Attribution 4.0 International (CC BY 4.0)","retrieval_date":"2026-08-30","content_hash":"sha256:b02225c3d04381a5fa9d6358c3cb0b0f0deba9044857f20e1f18fbb033e43080"},
  {"authority_name":"ACARA","authority_type":"statutory curriculum authority","authority_evidence_url":"https://www.acara.edu.au/about-us","publication_owner":"Australian Curriculum, Assessment and Reporting Authority (ACARA)","authority_verification_status":"verified","jurisdiction":"Australia","school_phase":"F-10","learning_area_or_subject":"Technologies","document_title":"Technologies | V9 Australian Curriculum","version_or_effective_year":"9.0","url":"https://www.australiancurriculum.edu.au/curriculum-information/understand-this-learning-area/technologies","locator":"Learning area > Technologies > Structure","licence":"Creative Commons Attribution 4.0 International (CC BY 4.0)","retrieval_date":"2026-08-30","content_hash":"sha256:b0ae8d21badf821b6f55cad785031099c3c1c515256eaa86c57b39d5ad072564"},
  {"authority_name":"ACARA","authority_type":"statutory curriculum authority","authority_evidence_url":"https://www.acara.edu.au/about-us","publication_owner":"Australian Curriculum, Assessment and Reporting Authority (ACARA)","authority_verification_status":"verified","jurisdiction":"Australia","school_phase":"F-10","learning_area_or_subject":"Languages","document_title":"Languages | V9 Australian Curriculum","version_or_effective_year":"9.0","url":"https://www.australiancurriculum.edu.au/curriculum-information/understand-this-learning-area/languages","locator":"Learning area > Languages > Structure","licence":"Creative Commons Attribution 4.0 International (CC BY 4.0)","retrieval_date":"2026-08-30","content_hash":"sha256:42724e9ad05594891f87987b4a58d8b0e561e2710a6c5491bb47e62cad358645"},
  {"authority_name":"ACARA","authority_type":"statutory curriculum authority","authority_evidence_url":"https://www.acara.edu.au/about-us","publication_owner":"Australian Curriculum, Assessment and Reporting Authority (ACARA)","authority_verification_status":"verified","jurisdiction":"Australia","school_phase":"F-10","learning_area_or_subject":"General capabilities","document_title":"General capabilities | V9 Australian Curriculum","version_or_effective_year":"9.0","url":"https://www.australiancurriculum.edu.au/f-10-curriculum/general-capabilities","locator":"F-10 Curriculum > General capabilities > seven capabilities","licence":"Creative Commons Attribution 4.0 International (CC BY 4.0)","retrieval_date":"2026-08-30","content_hash":"sha256:2fe7ac9ff4a58813aa8d5b2797dbc32515906e39d67dae8e478e0d9eb71fac8a"},
  {"authority_name":"ACARA","authority_type":"statutory curriculum authority","authority_evidence_url":"https://www.acara.edu.au/about-us","publication_owner":"Australian Curriculum, Assessment and Reporting Authority (ACARA)","authority_verification_status":"verified","jurisdiction":"Australia","school_phase":"F-10","learning_area_or_subject":"Cross-curriculum priorities","document_title":"Cross-curriculum priorities | V9 Australian Curriculum","version_or_effective_year":"9.0","url":"https://www.australiancurriculum.edu.au/f-10-curriculum/cross-curriculum-priorities","locator":"F-10 Curriculum > Cross-curriculum priorities > three priorities","licence":"Creative Commons Attribution 4.0 International (CC BY 4.0)","retrieval_date":"2026-08-30","content_hash":"sha256:42f36d94d534ceb344433e885c844a7e7e8017d0cfc1663dcfd9dce10bd7a5cb"},
  {"authority_name":"ACARA","authority_type":"statutory curriculum authority","authority_evidence_url":"https://www.acara.edu.au/about-us","publication_owner":"Australian Curriculum, Assessment and Reporting Authority (ACARA)","authority_verification_status":"verified","jurisdiction":"Australia","school_phase":"F-10","learning_area_or_subject":"EAL/D students","document_title":"EAL/D students | V9 Australian Curriculum","version_or_effective_year":"9.0","url":"https://www.australiancurriculum.edu.au/student-diversity/eal-d-students","locator":"Student diversity > EAL/D students > EAL/D Overview","licence":"Creative Commons Attribution 4.0 International (CC BY 4.0)","retrieval_date":"2026-08-30","content_hash":"sha256:8cce5db455bb4e9f8bf8546039b12a509831b09ff3ac90e0242ce238be4577dd"},
  {"authority_name":"ACARA","authority_type":"statutory curriculum authority","authority_evidence_url":"https://www.acara.edu.au/about-us","publication_owner":"Australian Curriculum, Assessment and Reporting Authority (ACARA)","authority_verification_status":"verified","jurisdiction":"Australia","school_phase":"F-10","learning_area_or_subject":"Students with disability","document_title":"Students with disability | V9 Australian Curriculum","version_or_effective_year":"9.0","url":"https://www.australiancurriculum.edu.au/student-diversity/students-with-disability","locator":"Student diversity > Meeting the needs of students with disability","licence":"Creative Commons Attribution 4.0 International (CC BY 4.0)","retrieval_date":"2026-08-30","content_hash":"sha256:0d9eac4c8b40000ab8447f84290316deae23123625cc9fa2c67667c0faaa4aad"},